{"schemaVersion":13,"workflowId":"control-choice","triggers":[{"id":"start","handler":"trigger.manual","config":{"kind":"object","fields":{}}}],"graph":{"entryNodeIds":["ready"],"nodes":[{"id":"ready","handler":"runtime.script","inputs":{"kind":"object","fields":{"source":{"kind":"literal","value":"return true;"}}},"scriptRuntime":{"bindingVersion":1,"bindings":["context","attempt","services","secrets"],"requiredSecrets":[]}},{"id":"__woml_choice__root_1__select","handler":"engine.choice-select","inputs":{"kind":"object","fields":{}}},{"id":"yes","handler":"runtime.script","inputs":{"kind":"object","fields":{"source":{"kind":"literal","value":"return 1;"}}},"scriptRuntime":{"bindingVersion":1,"bindings":["context","attempt","services","secrets"],"requiredSecrets":[]}},{"id":"no","handler":"runtime.script","inputs":{"kind":"object","fields":{"source":{"kind":"literal","value":"return 0;"}}},"scriptRuntime":{"bindingVersion":1,"bindings":["context","attempt","services","secrets"],"requiredSecrets":[]}},{"id":"__woml_choice__root_1__join","handler":"engine.choice-join","inputs":{"kind":"object","fields":{}}},{"id":"finish","handler":"runtime.script","inputs":{"kind":"object","fields":{"source":{"kind":"literal","value":"return context.steps.ready;"}}},"scriptRuntime":{"bindingVersion":1,"bindings":["context","attempt","services","secrets"],"requiredSecrets":[]}},{"id":"__woml_workflow__settlement","handler":"engine.workflow-settlement","inputs":{"kind":"object","fields":{}}}],"edges":[{"id":"ready-to-__woml_choice__root_1__select","from":"ready","to":"__woml_choice__root_1__select","condition":{"kind":"always"}},{"id":"__woml_choice__root_1:when:0","from":"__woml_choice__root_1__select","to":"yes","condition":{"kind":"boolean","value":{"kind":"contextReference","path":["steps","ready"]}}},{"id":"__woml_choice__root_1:otherwise","from":"__woml_choice__root_1__select","to":"no","condition":{"kind":"always"}},{"id":"__woml_choice__root_1:when:0:join","from":"yes","to":"__woml_choice__root_1__join","condition":{"kind":"always"}},{"id":"__woml_choice__root_1:otherwise:join","from":"no","to":"__woml_choice__root_1__join","condition":{"kind":"always"}},{"id":"__woml_choice__root_1__join-to-finish","from":"__woml_choice__root_1__join","to":"finish","condition":{"kind":"always"}},{"id":"__woml_workflow__:main:settlement","from":"finish","to":"__woml_workflow__settlement","condition":{"kind":"always"}}],"forks":[],"choices":[{"choiceId":"__woml_choice__root_1","selectorNodeId":"__woml_choice__root_1__select","joinNodeId":"__woml_choice__root_1__join","armIds":["__woml_choice__root_1:when:0","__woml_choice__root_1:otherwise"]}],"contextVisibility":[{"nodeId":"ready","stepIds":[]},{"nodeId":"yes","stepIds":["ready"]},{"nodeId":"no","stepIds":["ready"]},{"nodeId":"finish","stepIds":["ready"]}],"settlement":{"nodeId":"__woml_workflow__settlement","mainResultNodeId":"finish","ownedBranchTerminalNodeIds":[]}},"runtimePolicy":{"profileVersion":1,"concurrency":1}}
